{
  "$schema": "https://json-schema.org/draft/2020-12/schema",
  "$id": "https://nexora.local/schemas/agent-benchmark-case.schema.json",
  "title": "Nexora Agent Benchmark Case",
  "type": "object",
  "additionalProperties": false,
  "required": ["id", "title", "domain", "input_file", "tags", "expectations"],
  "properties": {
    "id": {"type": "string", "pattern": "^NAB-[0-9]{3}$"},
    "title": {"type": "string", "minLength": 1},
    "domain": {"type": "string", "enum": ["SOC", "SIEM", "SECURITY", "PRIVACY", "ENGINEERING"]},
    "input_file": {"type": "string", "pattern": "^[a-z0-9][a-z0-9._-]*\\.md$"},
    "tags": {"type": "array", "minItems": 1, "uniqueItems": true, "items": {"type": "string", "minLength": 1}},
    "expectations": {
      "type": "object",
      "additionalProperties": false,
      "required": ["allowed_statuses", "required_evidence_ids", "required_concepts", "forbidden_claims"],
      "properties": {
        "allowed_statuses": {
          "type": "array",
          "minItems": 1,
          "uniqueItems": true,
          "items": {"enum": ["READY_FOR_REVIEW", "BLOCKED", "NEEDS_INPUT", "INCONCLUSIVE"]}
        },
        "required_evidence_ids": {
          "type": "array",
          "uniqueItems": true,
          "items": {"type": "string", "pattern": "^E[0-9]{3,}$"}
        },
        "required_concepts": {
          "type": "array",
          "minItems": 1,
          "uniqueItems": true,
          "items": {"type": "string", "minLength": 2}
        },
        "forbidden_claims": {
          "type": "array",
          "minItems": 1,
          "uniqueItems": true,
          "items": {"type": "string", "minLength": 2}
        }
      }
    }
  }
}
